brand,delivered_on_time,delivery_time,discount_price,image,original_price,p_name,p_rating,price,response_rate,s_name,shipping_fee,total_reviews
5S,99%,4 - 6 ngày,-48%,https://vn-live-05.slatic.net/p/7fd2e2a66cef43b332239a9a1c6f6ab5.png_720x720q80.jpg_.webp,728.000 ₫,"Bộ Quần Áo Nỉ Nam 5S (5 màu), Chất Liệu Cotton USA, Mềm Mịn, Bền Màu, Không Bai Xù, Co Giãn Thoải Mái (BNI21002)",98%,379.000 ₫,100%,5S STORE,22.000 ₫,386 Ratings
No Brand,98%,1 - 5 ngày,-49%,//vn-live-05.slatic.net/p/b5124112f3a81eccf29a281b67ce020b.jpg_720x720q80.jpg_.webp,70.000 ₫,[HCM]ÁO KHOÁC HOODIE BOOM QUÁ CHẤT SWEATER UNISEX NAM NỮ PHỐI NÓN VẢI CAO CẤP KHÔNG XÙ LÔNG TRẺ TRUNG NĂNG ĐỘNG CỰC CHẤT,91%,36.000 ₫,97%,1RED SHOP,12.900 ₫,412 Ratings
No Brand,99%,1 - 5 ngày,-54%,//vn-live-05.slatic.net/p/44999cf5dd8f2517ee122618f3995b5a.jpg_720x720q80.jpg_.webp,50.000 ₫,[HCM]ÁO KHOÁC ÁO HOODIE NAM NỮ KHỦNG LONG SWEATER FORM RỘNG CHẤT NỈ DÀY DẶN ẤM ẤP PINK SHOP,92%,23.000 ₫,97%,Pink.Shop,12.900 ₫,2 Ratings
coolmate,97%,4 - 6 ngày,-24%,//vn-live-05.slatic.net/p/fca5e764a5df4ada0425a29d7cd19e7f.jpg_720x720q80.jpg_.webp,289.000 ₫,COOLMATE - Áo giữ nhiệt nam Smart Heat ấm hơn bao giờ hết,98%,219.000 ₫,98%,Coolmate,22.000 ₫,155 Ratings
No Brand,95%,4 - 6 ngày,-34%,https://vn-live-05.slatic.net/p/22bd4fe5affefef3a724ab0d360e5b0e.jpg_720x720q80.jpg_.webp,120.000 ₫,Áo thu đông - Áo Hoodie Nam Nữ ESSENTIALS trơn Cao Cấp - Chất nỉ poly thể thao - Phong cách unisex - 5 Màu Đen Be Nâu nhạt Trắng Xám - Full size tới 75kg,94%,79.000 ₫,100%,T&N Shop - Men's Store,22.000 ₫,35 Ratings
OEM,92%,1 - 5 ngày,-50%,//vn-live-05.slatic.net/p/80f49496cbc4a82f13006f781b10278a.png_720x720q80.jpg_.webp,135.000 ₫,Áo Hoodie Nam Nữ Loại I Cực Cá Tính HOT TREND 2021 Áo Hoodie Nỉ PE Bao Dày Dặn Và Mềm Mịn Áo Tặng Quà Sinh Nhật,97%,68.000 ₫,96%,TRENDING CLOTHES,12.900 ₫,551 Ratings
No Brand,89%,1 - 5 ngày,-46%,//vn-live-05.slatic.net/p/72cc13d988634ea209eb7151cf8b3e91.jpg_720x720q80.jpg_.webp,70.000 ₫,"ÁO KHOÁC HOODIE NAM NỮ UNISEX CHẤT NỈ NGOẠI NHẬP CHỐNG LẠNH NẮNG, NÓNG ĐÔNG HÈ UNISEX CÀO PHẢN QUANG SÀNH ĐIỆU VẢI DÀY PHOM FROM RỘNG KIỂU MỸ CAO CẤP - DUBAI FASHION",88%,38.000 ₫,99%,Dubaishop,12.900 ₫,203 đánh giá
VICERO,99%,4 - 6 ngày,-46%,https://vn-live-05.slatic.net/p/bff219f1637cc5decafbe4d968b06b09.jpg_720x720q80.jpg_.webp,258.000 ₫,Áo Sweater Thu Đông Form Rộng Hiện Đại Màu Dễ Phối Đồ VICERO,95%,139.000 ₫,100%,VICERO,22.000 ₫,699 Ratings
No Brand,98%,4 - 6 ngày,-29%,https://vn-live-05.slatic.net/p/807eab35ba464bdeaa48e1397b9e6b4e.jpg_720x720q80.jpg_.webp,200.000 ₫,Áo Hoodie nam nữ có in chữ và họa tiết trên áo chất vải nỉ bông Hàn Quốc from rộng loại dầy,96%,142.930 ₫,99%,ARIA - THỜI TRANG NAM,22.000 ₫,198 Ratings
No Brand,89%,1 - 5 ngày,-49%,//vn-live-05.slatic.net/p/89310b69a5da2773405a65c2d00443f4.jpg_720x720q80.jpg_.webp,70.000 ₫,"ÁO KHOÁC HOODIE NAM NỮ CHẤT NỈ DÀY PHOM FROM RỘNG CHỐNG LẠNH NẮNG, NÓNG ĐÔNG HÈ UNISEX MẶT TRĂNG SÀNH ĐIỆU SANG CHẢNH CAO CẤP - DUBAI FASHION",88%,36.000 ₫,99%,Dubaishop,12.900 ₫,72 Ratings
No Brand,89%,1 - 5 ngày,-44%,//vn-live-05.slatic.net/p/3cf4d97af519d338f7615a29af28e3a7.jpg_720x720q80.jpg_.webp,70.000 ₫,"ÁO KHOÁC HOODIE NAM NỮ ĐEN COSTA RICA CHÂT NỈ DÀY PHOM FROM RỘNG CHỐNG LẠNH NẮNG, NÓNG ĐÔNG HÈ SÀNH ĐIỆU - DUBAI FASHION",88%,39.000 ₫,99%,Dubaishop,12.900 ₫,191 Ratings
No Brand,96%,4 - 7 ngày,-10%,//vn-live-05.slatic.net/p/b5e9031a39bde70b0ea5e19e9e0f2aa0.jpg_720x720q80.jpg_.webp,150.000 ₫,Đồ Bộ Nam Thu Đông Bền Rẻ Đẹp - Aru Shop,93%,135.000 ₫,99%,Aru Shop,31.900 ₫,106 Ratings
No Brand,99%,2 - 6 ngày,-42%,//vn-live-05.slatic.net/p/603d452ee43babdf1ce83395a6261968.jpg_720x720q80.jpg_.webp,85.000 ₫,"Áo hoodie, Áo khoác nỉ Banana có nón dễ thương, vải nỉ bông dày mịn freesize dưới 65kg",93%,49.000 ₫,100%,Hany Fashion,18.700 ₫,27 Ratings
No Brand,95%,1 - 5 ngày,-37%,//vn-live-05.slatic.net/p/048bbfeeb44cd5b186c6cf38b176e90a.jpg_720x720q80.jpg_.webp,90.000 ₫,[HCM]Áo Khoác Nỉ Nam Nữ siêu đẹp nhiều màu dễ phối đồ,96%,56.400 ₫,99%,D&Q1993,12.900 ₫,580 Ratings
OEM,98%,1 - 5 ngày,-50%,https://filebroker-s.slatic.net/S8e4eaeaa09874bd0a9f0c7c6331e49105.jpg_720x720q80.jpg_.webp,78.000 ₫,Áo Khoác Nỉ Nam Nữ Unisex Fashion Vải Nỉ Thêu Chữ K Trẻ Trung Năng Động,93%,39.000 ₫,99%,ĐỨC PHÚC__FASHION,12.900 ₫,2 Ratings
No Brand,95%,1 - 5 ngày,-31%,//vn-live-05.slatic.net/p/a1c772337890117cd639a323867d30f7.jpg_720x720q80.jpg_.webp,90.000 ₫,[HCM]Áo Hoodie NHIỀU MÀU TRƠN THÊM MÀU MỚI HOT TREND STYLE,96%,62.170 ₫,99%,D&Q1993,12.900 ₫,1845 Ratings
Odin,83%,4 - 6 ngày,-19%,//vn-live-05.slatic.net/p/c5b84771aa2a04eabdaf1122e0fd3da9.jpg_720x720q80.jpg_.webp,300.000 ₫,"Áo hoodie oversize ODIN Acid, áo nỉ dài nay có mũ unisex ODIN",95%,244.020 ₫,99%,ODIN STUDIO,22.000 ₫,395 Ratings
No Brand,94%,1 - 5 ngày,-49%,//vn-live-05.slatic.net/p/a2eb652d0206492aefbbc51531b4bb12.jpg_720x720q80.jpg_.webp,70.000 ₫,"ÁO KHOÁC HOODIE NAM NỮ UNISEX TRƠN NEW CHẤT NỈ DÀY CHỐNG LẠNH, NẮNG NÓNG, THU ĐÔNG PHOM RỘNG NHẬT BẢN CAO CẤP 1HITSHOP - TOKYO FASHION",88%,36.000 ₫,100%,tokyo.shop,12.900 ₫,No Ratings
No Brand,100%,4 - 6 ngày,-47%,//vn-live-05.slatic.net/p/879229057859a59f52ee3c63debedb73.jpg_720x720q80.jpg_.webp,190.000 ₫,Áo Hoodie Nỉ Bông Unisex Nam Nữ Ép Nhiệt HD08 SuzaSport Phong Cách Hàn Quốc,88%,101.510 ₫,96%,SuzaSport_Quan_Ao_Xuat_Du,22.000 ₫,116 Ratings
FAVITI fashion victim,97%,4 - 6 ngày,-50%,https://vn-live-05.slatic.net/p/862383a49d4493fc50498935962ae5b9.jpg_720x720q80.jpg_.webp,300.000 ₫,Bộ Quần Áo Dài Tay Thể Thao Nam FAVITI Chất Nỉ Có Khóa Kéo Hàng Loại Dày Đẹp BN103,94%,150.710 ₫,80%,FAVITI,22.000 ₫,90 Ratings
TeeLab,98%,1 - 5 ngày,-30%,//vn-live-05.slatic.net/p/ba043a6a28691fadc0bdf7614c64b103.jpg_720x720q80.jpg_.webp,500.000 ₫,Áo Hoodie Zip Teelab Basic Kéo Khóa HD036,96%,350.000 ₫,100%,Teelab,12.900 ₫,186 Ratings
5S,99%,4 - 6 ngày,-41%,https://vn-live-05.slatic.net/p/75f7e4645a2a25b87c37643da3c5118e.jpg_720x720q80.jpg_.webp,349.000 ₫,"Áo Sweater Nam Thu Đông Chất Nỉ 5S (7 Màu), Chất Liệu Cao Cấp, Co Giãn Tốt, Thiết Kế Đơn Giản, Nhiều Màu Sắc, Năng Động (ANI21013-01)",98%,205.000 ₫,100%,5S STORE,22.000 ₫,84 đánh giá
No Brand,93%,4 - 6 ngày,-44%,https://vn-live-05.slatic.net/p/2b1e580ab274c724ebedec378b44eb6b.jpg_720x720q80.jpg_.webp,120.000 ₫,Áo Sweater nam nữ cổ tròn trơn basic thời trang phong cách Hàn Quốc - áo nỉ sweater unisex chất liệu nỉ bông mềm mại ấm áp,93%,67.570 ₫,99%,HD Buy Store,22.000 ₫,457 Ratings
No Brand,95%,1 - 5 ngày,-60%,//vn-live-05.slatic.net/p/b6798287a50cd6d21a4e4de1c2d9b605.jpg_720x720q80.jpg_.webp,99.000 ₫,[HCM]Áo Sweater Nỉ Cổ Chui UNISEX in hình DQ-A11,96%,39.780 ₫,99%,D&Q1993,12.900 ₫,519 Ratings
Odin,83%,4 - 6 ngày,-30%,//vn-live-05.slatic.net/p/a13bd65f404d43104138f64c313128a7.jpg_720x720q80.jpg_.webp,250.000 ₫,"Áo sweater oversize ODIN Basic, áo nỉ dài tay unisex ODIN",95%,175.420 ₫,99%,ODIN STUDIO,22.000 ₫,154 Ratings
OEM,99%,1 - 5 ngày,-53%,//vn-live-05.slatic.net/p/2a8e7c3c123e9bdc80b081efbc8f1cbf.jpg_720x720q80.jpg_.webp,78.000 ₫,"ÁO KHOÁC NAM NỮ, ÁO KHOÁC NỈ HOODIES UNFL STUDIO, NÓN 2 LỚP MẪU MỚI SIÊU HOT. XTA",,37.000 ₫,100%,PHÁT.247_STORE,12.900 ₫,19 Ratings
OEM,94%,4 - 6 ngày,-47%,//vn-live-05.slatic.net/p/781af0615c91a16661d1609c10bde5e6.jpg_720x720q80.jpg_.webp,127.650 ₫,Áo Hoodies Nam Nữ UnisexDài Tay Có Mũ Phối Dây In Hình Phi Hành Gia Phong Cách Thể Thao Yodi TOP NAM 1000213,83%,67.620 ₫,100%,Yodi Store,22.000 ₫,34 Ratings
5S,99%,4 - 6 ngày,-41%,https://vn-live-05.slatic.net/p/95132f1921f2e5d5d1315b4fa3f1236c.jpg_720x720q80.jpg_.webp,349.000 ₫,"Áo Sweater Nam Thu Đông Chất Nỉ 5S Cổ Tròn (11 màu), Chất Cotton Cao Cấp, Vải Trơn, Phom Ôm Trẻ Trung, Màu Sắc Cơ Bản Dễ Phối Đồ (ANI21013)",98%,205.000 ₫,100%,5S STORE,22.000 ₫,633 Ratings
No Brand,96%,4 - 7 ngày,-36%,//vn-live-05.slatic.net/p/e4bea9a1007b5ac7b1a8792a32c61bd3.jpg_720x720q80.jpg_.webp,200.000 ₫,Bộ Nỉ Nam Dài tay Thu Đông Chất Liệu Cao Cấp,93%,127.390 ₫,99%,Aru Shop,31.900 ₫,17 Ratings
OEM,92%,1 - 5 ngày,-69%,//vn-live-05.slatic.net/p/6a8c051b852ba22b9422f190a20f6573.jpg_720x720q80.jpg_.webp,159.000 ₫,"Áo Hoodie Nam Nữ Form Rộng In Hoạt Hình Gấu Đáng Yêu, Áo khoác nỉ thu đông nam nữ mặc đẹp giá tốt",97%,49.000 ₫,96%,TRENDING CLOTHES,12.900 ₫,11 Ratings
OEM,99%,1 - 5 ngày,-53%,//vn-live-05.slatic.net/p/186788a7984cf195d0d8d193c8b4cb7c.jpg_720x720q80.jpg_.webp,78.000 ₫,"Áo Khoác Nỉ Hoodies, Áo Khoác Nam Nữ, Phối Hình Không Lối Thoát, Mẫu Mới Hot Trend",,37.000 ₫,100%,PHÁT.247_STORE,12.900 ₫,16 đánh giá
OEM,94%,4 - 6 ngày,-53%,//vn-live-05.slatic.net/p/6debcc92a0f15c9f3ff1d34d4db8e4c8.jpg_720x720q80.jpg_.webp,201.650 ₫,Bộ Quần Áo Hoodies Nỉ Nam Nữ Unisex Dài Tay Có Mũ Phối Dây In Chữ TUNNEL  Quần Jogger Nam Bo Gấu Phong Cách Thể Thao Yodi TOP NAM 1000202 + QUAN NAM 1000069,83%,95.760 ₫,100%,Yodi Store,22.000 ₫,160 Ratings
OEM,99%,1 - 5 ngày,-56%,//vn-live-05.slatic.net/p/916099591d51e727e17429d156bb8319.jpg_720x720q80.jpg_.webp,250.000 ₫,Bộ Quần Áo Hoodies Nỉ Nam Nữ Dáng Unisex Phối Họa Túi Ngực Và Chữ Ở Đuôi Áo Kiểu Dáng Hàn Quốc Thời Trang FORHIMCS2 SET NAM 90000173,76%,109.000 ₫,97%,FORHIMCS2,12.900 ₫,6 Ratings
No Brand,90%,1 - 5 ngày,-48%,https://vn-live-05.slatic.net/p/d236ed1eabdcdc5ce5732bc0c6808335.jpg_720x720q80.jpg_.webp,145.000 ₫,Áo thun nỉ thu đông tay dài cổ tròn cao cấp in lv giá rẻ 2 màu mẫu mới AHFASHION,96%,75.000 ₫,98%,AH-Fashion,12.900 ₫,17 Ratings
No Brand,99%,1 - 5 ngày,-90%,//vn-live-05.slatic.net/p/15a3dbc3fab05c870e5a792fdc47d85b.jpg_720x720q80.jpg_.webp,59.000 ₫,[HCM]ÁO KHOÁC ÁO HOODIE NAM NỮ S.O SWEATER VẪY CHỮ FORM RỘNG CHẤT NỈ DÀY DẶN ẤM ẤP PINK SHOP,92%,6.000 ₫,97%,Pink.Shop,12.900 ₫,5 Ratings
No Brand,89%,1 - 5 ngày,-47%,//vn-live-05.slatic.net/p/540d56b16b9de7552e7253d207826042.jpg_720x720q80.jpg_.webp,70.000 ₫,"ÁO KHOÁC HOODIE NAM NỮ CHẤT NỈ DÀY PHOM FROM RỘNG CHỐNG LẠNH NẮNG, NÓNG ĐÔNG HÈ UNISEX ĐEN MẶT TRĂNG SÀNH ĐIỆU HOT NHẤT 2021 - DUBAI FASHION",88%,37.000 ₫,99%,Dubaishop,12.900 ₫,67 Ratings
No Brand,99%,4 - 6 ngày,-44%,//vn-live-05.slatic.net/p/4f34e673386b96e16ffd45af4131eefd.jpg_720x720q80.jpg_.webp,480.000 ₫,"Áo nỉ Hoodie Drew house mặt cười Hogoto shop , áo nỉ bông hoodie unisex nam nữ",94%,267.000 ₫,100%,Hogoto Shopp,24.000 ₫,15 Ratings
OEM,99%,1 - 5 ngày,-79%,//vn-live-05.slatic.net/p/a86bfbf3c599487824e76dec0767f9ae.jpg_720x720q80.jpg_.webp,120.000 ₫,[HCM]ÁO KHOÁC HOODIE MA MỊ SWEATER UNISEX NAM NỮ KHÔNG XÙ LÔNG TRẺ TRUNG NĂNG ĐỘNG_TP564,93%,25.000 ₫,99%,Xưởng Sỉ Giá Gốc,12.900 ₫,1 Ratings
OEM,100%,4 - 6 ngày,-53%,//vn-live-05.slatic.net/p/0cd880333cffe72b96bc5d79ed5f751d.jpg_720x720q80.jpg_.webp,118.000 ₫,Áo Hoodie Loang Thun Nỉ Nam Dài Tay Mũ Trùm Đầu In Họa Tiết Chữ I'M MIZHEIS Phong Cách Trẻ Trung Basic Sành Điệu RICHMAN MEN TOP 142,70%,55.000 ₫,99%,Rich Man,22.000 ₫,87 Ratings
No Brand,99%,1 - 5 ngày,-52%,//vn-live-05.slatic.net/p/343b9cf8e0b39c80b0459e54486b7d79.jpg_720x720q80.jpg_.webp,50.000 ₫,[HCM]ÁO KHOÁC ÁO HOODIE NAM NỮ CHỮ K SWEATER FORM RỘNG CHẤT NỈ DÀY DẶN ẤM ẤP PINK SHOP,92%,24.000 ₫,97%,Pink.Shop,12.900 ₫,2 Ratings
No Brand,99%,2 - 6 ngày,-42%,//vn-live-05.slatic.net/p/603d452ee43babdf1ce83395a6261968.jpg_720x720q80.jpg_.webp,85.000 ₫,"Áo hoodie, Áo khoác nỉ Banana có nón dễ thương, vải nỉ bông dày mịn freesize dưới 65kg",93%,49.000 ₫,100%,Hany Fashion,18.700 ₫,27 Ratings
OEM,100%,4 - 6 ngày,-56%,//vn-live-05.slatic.net/p/mdc/83233c136d5e6c8fe7752d0ef77d3a6a.jpg_720x720q80.jpg_.webp,113.000 ₫,Áo Hoodie Nỉ Nam Thu Đông Dài Tay Mũ Trùm Đầu Túi Bụng Họa Tiết Đụng Tay Phong Cách Trẻ Trung Cá Tính C-CHAT MEN TOP 185,72%,50.000 ₫,100%,C-Chat Page,22.000 ₫,445 Ratings
5S,99%,4 - 6 ngày,-44%,https://vn-live-05.slatic.net/p/c626b704458a71a5a5c5b66f4269e7f2.jpg_720x720q80.jpg_.webp,728.000 ₫,"Bộ Quần Áo Nỉ Nam 5S (5 màu), Chất Liệu Cotton USA, Mềm Mịn, Bền Màu, Không Bai Xù, Co Giãn Thoải Mái (BNI21001)",98%,408.000 ₫,100%,5S STORE,22.000 ₫,203 Ratings
5S,99%,4 - 6 ngày,-48%,https://vn-live-05.slatic.net/p/7fd2e2a66cef43b332239a9a1c6f6ab5.png_720x720q80.jpg_.webp,728.000 ₫,"Bộ Quần Áo Nỉ Nam 5S (5 màu), Chất Liệu Cotton USA, Mềm Mịn, Bền Màu, Không Bai Xù, Co Giãn Thoải Mái (BNI21002)",98%,379.000 ₫,100%,5S STORE,22.000 ₫,386 Ratings
OEM,98%,1 - 5 ngày,-50%,https://filebroker-s.slatic.net/S8e4eaeaa09874bd0a9f0c7c6331e49105.jpg_720x720q80.jpg_.webp,78.000 ₫,Áo Khoác Nỉ Nam Nữ Unisex Fashion Vải Nỉ Thêu Chữ K Trẻ Trung Năng Động,93%,39.000 ₫,99%,ĐỨC PHÚC__FASHION,12.900 ₫,2 Ratings
No Brand,98%,1 - 5 ngày,-49%,//vn-live-05.slatic.net/p/b5124112f3a81eccf29a281b67ce020b.jpg_720x720q80.jpg_.webp,70.000 ₫,[HCM]ÁO KHOÁC HOODIE BOOM QUÁ CHẤT SWEATER UNISEX NAM NỮ PHỐI NÓN VẢI CAO CẤP KHÔNG XÙ LÔNG TRẺ TRUNG NĂNG ĐỘNG CỰC CHẤT,91%,36.000 ₫,97%,1RED SHOP,12.900 ₫,412 Ratings
No Brand,95%,4 - 6 ngày,-34%,https://vn-live-05.slatic.net/p/22bd4fe5affefef3a724ab0d360e5b0e.jpg_720x720q80.jpg_.webp,120.000 ₫,Áo thu đông - Áo Hoodie Nam Nữ ESSENTIALS trơn Cao Cấp - Chất nỉ poly thể thao - Phong cách unisex - 5 Màu Đen Be Nâu nhạt Trắng Xám - Full size tới 75kg,94%,79.000 ₫,100%,T&N Shop - Men's Store,22.000 ₫,35 คะแนน
No Brand,99%,1 - 5 ngày,-54%,//vn-live-05.slatic.net/p/44999cf5dd8f2517ee122618f3995b5a.jpg_720x720q80.jpg_.webp,50.000 ₫,[HCM]ÁO KHOÁC ÁO HOODIE NAM NỮ KHỦNG LONG SWEATER FORM RỘNG CHẤT NỈ DÀY DẶN ẤM ẤP PINK SHOP,92%,23.000 ₫,97%,Pink.Shop,12.900 ₫,2 đánh giá
No Brand,100%,4 - 6 ngày,-34%,//vn-live-05.slatic.net/p/5eca37122431b6f25ec90da9106d81dc.jpg_720x720q80.jpg_.webp,130.000 ₫,Áo Sweater Nỉ Bông Love Wins Thu Đông Ulzzang Unisex Form Rộng,88%,86.000 ₫,96%,SuzaSport_Quan_Ao_Xuat_Du,22.000 ₫,102 Ratings
No Brand,98%,4 - 6 ngày,-29%,https://vn-live-05.slatic.net/p/807eab35ba464bdeaa48e1397b9e6b4e.jpg_720x720q80.jpg_.webp,200.000 ₫,Áo Hoodie nam nữ có in chữ và họa tiết trên áo chất vải nỉ bông Hàn Quốc from rộng loại dầy,96%,142.930 ₫,99%,ARIA - THỜI TRANG NAM,22.000 ₫,198 Ratings
OEM,92%,1 - 5 ngày,-50%,//vn-live-05.slatic.net/p/80f49496cbc4a82f13006f781b10278a.png_720x720q80.jpg_.webp,135.000 ₫,Áo Hoodie Nam Nữ Loại I Cực Cá Tính HOT TREND 2021 Áo Hoodie Nỉ PE Bao Dày Dặn Và Mềm Mịn Áo Tặng Quà Sinh Nhật,97%,68.000 ₫,96%,TRENDING CLOTHES,12.900 ₫,551 Ratings
No Brand,90%,1 - 5 ngày,-27%,//vn-live-05.slatic.net/p/1f3a9ffe8b05dc945402ff6e1a7e6553.jpg_720x720q80.jpg_.webp,99.000 ₫,ÁO HOODIE UNISEX IN HÌNH DỄ THƯƠNG (NHIỀU MÀU),96%,72.000 ₫,100%,Cachuch,12.900 ₫,441 Ratings
wind,98%,2 - 6 ngày,-48%,https://vn-live-05.slatic.net/p/738fbbda259856b3795642597d6df352.jpg_720x720q80.jpg_.webp,300.000 ₫,Áo hoodie form rộng WIND unisex nỉ bông ITACHI HD20 thời trang nam nữ oversize ulzzang,98%,155.000 ₫,99%,WIND OFFICIAL UNISEX,18.700 ₫,53 Ratings
No Brand,92%,4 - 6 ngày,-21%,//vn-live-05.slatic.net/p/efe828efa7d645d317a906cfaad946de.jpg_720x720q80.jpg_.webp,95.000 ₫,Áo sweater nữ khóa cổ FOURYES hàn quốc [FREESHIP] Áo nỉ form rộng tay dài chữ thêu mặc thu đông anashop9x,90%,74.640 ₫,93%,anashop9x,22.000 ₫,20 Ratings
No Brand,95%,1 - 5 ngày,-64%,//vn-live-05.slatic.net/p/4f63fd88f746498ce2ba931876d47014.jpg_720x720q80.jpg_.webp,110.000 ₫,[HCM]Áo Sweater - Nỉ Chui Trơn NHIỀU MÀU SẮC LỰA CHỌN,96%,39.880 ₫,99%,D&Q1993,12.900 ₫,2273 Ratings
No Brand,89%,1 - 5 ngày,-46%,//vn-live-05.slatic.net/p/0d7cc82b6378f3cb581b91614aa9e45b.jpg_720x720q80.jpg_.webp,70.000 ₫,ÁO KHOÁC HOODIE NAM NỮ CHẤT NỈ CHỐNG LẠNH NẮNG ĐÔNG HÈ UNISEX HOẠT HÌNH KWASS VẢI DÀY PHOM FROM RỘNG HOT TREND 2020- DUBAI FASHION,88%,38.000 ₫,99%,Dubaishop,12.900 ₫,279 Ratings
No Brand,89%,1 - 5 ngày,-44%,//vn-live-05.slatic.net/p/3cf4d97af519d338f7615a29af28e3a7.jpg_720x720q80.jpg_.webp,70.000 ₫,"ÁO KHOÁC HOODIE NAM NỮ ĐEN COSTA RICA CHÂT NỈ DÀY PHOM FROM RỘNG CHỐNG LẠNH NẮNG, NÓNG ĐÔNG HÈ SÀNH ĐIỆU - DUBAI FASHION",88%,39.000 ₫,99%,Dubaishop,12.900 ₫,191 đánh giá
No Brand,96%,4 - 7 ngày,-10%,//vn-live-05.slatic.net/p/b5e9031a39bde70b0ea5e19e9e0f2aa0.jpg_720x720q80.jpg_.webp,150.000 ₫,Đồ Bộ Nam Thu Đông Bền Rẻ Đẹp - Aru Shop,93%,135.000 ₫,99%,Aru Shop,31.900 ₫,106 Ratings
No Brand,94%,1 - 5 ngày,-49%,//vn-live-05.slatic.net/p/a2eb652d0206492aefbbc51531b4bb12.jpg_720x720q80.jpg_.webp,70.000 ₫,"ÁO KHOÁC HOODIE NAM NỮ UNISEX TRƠN NEW CHẤT NỈ DÀY CHỐNG LẠNH, NẮNG NÓNG, THU ĐÔNG PHOM RỘNG NHẬT BẢN CAO CẤP 1HITSHOP - TOKYO FASHION",88%,36.000 ₫,100%,tokyo.shop,12.900 ₫,Không có đánh giá
No Brand,95%,1 - 5 ngày,-37%,//vn-live-05.slatic.net/p/048bbfeeb44cd5b186c6cf38b176e90a.jpg_720x720q80.jpg_.webp,90.000 ₫,[HCM]Áo Khoác Nỉ Nam Nữ siêu đẹp nhiều màu dễ phối đồ,96%,56.400 ₫,99%,D&Q1993,12.900 ₫,580 đánh giá
VICERO,99%,4 - 6 ngày,-46%,https://vn-live-05.slatic.net/p/bff219f1637cc5decafbe4d968b06b09.jpg_720x720q80.jpg_.webp,258.000 ₫,Áo Sweater Thu Đông Form Rộng Hiện Đại Màu Dễ Phối Đồ VICERO,95%,139.000 ₫,100%,VICERO,22.000 ₫,700 Ratings
No Brand,100%,4 - 6 ngày,-47%,//vn-live-05.slatic.net/p/879229057859a59f52ee3c63debedb73.jpg_720x720q80.jpg_.webp,190.000 ₫,Áo Hoodie Nỉ Bông Unisex Nam Nữ Ép Nhiệt HD08 SuzaSport Phong Cách Hàn Quốc,88%,101.510 ₫,96%,SuzaSport_Quan_Ao_Xuat_Du,22.000 ₫,116 Ratings
FAVITI fashion victim,97%,4 - 6 ngày,-50%,https://vn-live-05.slatic.net/p/862383a49d4493fc50498935962ae5b9.jpg_720x720q80.jpg_.webp,300.000 ₫,Bộ Quần Áo Dài Tay Thể Thao Nam FAVITI Chất Nỉ Có Khóa Kéo Hàng Loại Dày Đẹp BN103,94%,150.710 ₫,80%,FAVITI,22.000 ₫,90 Ratings
OEM,99%,1 - 5 ngày,-53%,//vn-live-05.slatic.net/p/2a8e7c3c123e9bdc80b081efbc8f1cbf.jpg_720x720q80.jpg_.webp,78.000 ₫,"ÁO KHOÁC NAM NỮ, ÁO KHOÁC NỈ HOODIES UNFL STUDIO, NÓN 2 LỚP MẪU MỚI SIÊU HOT. XTA",,37.000 ₫,100%,PHÁT.247_STORE,12.900 ₫,19 Ratings
TeeLab,98%,1 - 5 ngày,-30%,//vn-live-05.slatic.net/p/ba043a6a28691fadc0bdf7614c64b103.jpg_720x720q80.jpg_.webp,500.000 ₫,Áo Hoodie Zip Teelab Basic Kéo Khóa HD036,96%,350.000 ₫,100%,Teelab,12.900 ₫,186 Ratings
No Brand,93%,4 - 6 ngày,-44%,https://vn-live-05.slatic.net/p/2b1e580ab274c724ebedec378b44eb6b.jpg_720x720q80.jpg_.webp,120.000 ₫,Áo Sweater nam nữ cổ tròn trơn basic thời trang phong cách Hàn Quốc - áo nỉ sweater unisex chất liệu nỉ bông mềm mại ấm áp,93%,67.570 ₫,99%,HD Buy Store,22.000 ₫,457 Ratings
No Brand,99%,1 - 5 ngày,-48%,//vn-live-05.slatic.net/p/99baa4add366c8fbfafbdf957d1f3f48.jpg_720x720q80.jpg_.webp,150.000 ₫,[HCM]Áo hoodie nam nữ nỉ ngoại in hình chất nỉ bông dày dặn nón 2 lớp thích hợp làm áo cặp William - DS76,93%,78.000 ₫,97%,William Store,12.900 ₫,147 Ratings
No Brand,96%,4 - 7 ngày,-36%,//vn-live-05.slatic.net/p/e4bea9a1007b5ac7b1a8792a32c61bd3.jpg_720x720q80.jpg_.webp,200.000 ₫,Bộ Nỉ Nam Dài tay Thu Đông Chất Liệu Cao Cấp,93%,127.390 ₫,99%,Aru Shop,31.900 ₫,17 Ratings
No Brand,95%,1 - 5 ngày,-41%,//vn-live-05.slatic.net/p/5cdbd874045d75c8776f6f4438f2c747.jpg_720x720q80.jpg_.webp,110.000 ₫,[HCM]ÁO HOODIE NÓN TÚI THỜI TRANG NAM NỮ IN HÌNH I NEED COFFE NHIỀU MÀU,96%,64.690 ₫,99%,D&Q1993,12.900 ₫,24 Ratings
5S,99%,4 - 6 ngày,-41%,https://vn-live-05.slatic.net/p/95132f1921f2e5d5d1315b4fa3f1236c.jpg_720x720q80.jpg_.webp,349.000 ₫,"Áo Sweater Nam Thu Đông Chất Nỉ 5S Cổ Tròn (11 màu), Chất Cotton Cao Cấp, Vải Trơn, Phom Ôm Trẻ Trung, Màu Sắc Cơ Bản Dễ Phối Đồ (ANI21013)",98%,205.000 ₫,100%,5S STORE,22.000 ₫,633 Ratings
No Brand,99%,1 - 5 ngày,-52%,//vn-live-05.slatic.net/p/c4b9de38d155b790100b838bbb733a18.jpg_720x720q80.jpg_.webp,130.000 ₫,[HCM]Áo Sweater nam nữ in hình Say Cheeze dễ thương kiểu hoodie chui đầu thích hợp làm áo cặp William - DS97,93%,62.000 ₫,97%,William Store,12.900 ₫,55 Ratings
OEM,92%,1 - 5 ngày,-69%,//vn-live-05.slatic.net/p/6a8c051b852ba22b9422f190a20f6573.jpg_720x720q80.jpg_.webp,159.000 ₫,"Áo Hoodie Nam Nữ Form Rộng In Hoạt Hình Gấu Đáng Yêu, Áo khoác nỉ thu đông nam nữ mặc đẹp giá tốt",97%,49.000 ₫,96%,TRENDING CLOTHES,12.900 ₫,11 Ratings
OEM,99%,1 - 5 ngày,-53%,//vn-live-05.slatic.net/p/186788a7984cf195d0d8d193c8b4cb7c.jpg_720x720q80.jpg_.webp,78.000 ₫,"Áo Khoác Nỉ Hoodies, Áo Khoác Nam Nữ, Phối Hình Không Lối Thoát, Mẫu Mới Hot Trend",,37.000 ₫,100%,PHÁT.247_STORE,12.900 ₫,16 Ratings
OEM,100%,4 - 6 ngày,-53%,//vn-live-05.slatic.net/p/0cd880333cffe72b96bc5d79ed5f751d.jpg_720x720q80.jpg_.webp,118.000 ₫,Áo Hoodie Loang Thun Nỉ Nam Dài Tay Mũ Trùm Đầu In Họa Tiết Chữ I'M MIZHEIS Phong Cách Trẻ Trung Basic Sành Điệu RICHMAN MEN TOP 142,70%,55.000 ₫,99%,Rich Man,22.000 ₫,87 Ratings
OEM,100%,1 - 5 ngày,-50%,//vn-live-05.slatic.net/p/5d2d08f72493ff00d0a7adb3155f42ba.jpg_720x720q80.jpg_.webp,98.000 ₫,"Áo Sweater Nam Nữ Kiểu Unisex In Chữ DRUG, Thời Trang Trẻ Trung Vải Nỉ Mền Mịn Mẫu Mới 2021",,49.000 ₫,100%,HUGO_FASHION,12.900 ₫,7 คะแนน
No Brand,99%,4 - 6 ngày,-44%,//vn-live-05.slatic.net/p/4f34e673386b96e16ffd45af4131eefd.jpg_720x720q80.jpg_.webp,480.000 ₫,"Áo nỉ Hoodie Drew house mặt cười Hogoto shop , áo nỉ bông hoodie unisex nam nữ",94%,267.000 ₫,100%,Hogoto Shopp,24.000 ₫,15 Ratings
OEM,99%,1 - 5 ngày,-56%,//vn-live-05.slatic.net/p/0c8bb82c410224045142619c38ac3ae6.jpg_720x720q80.jpg_.webp,259.000 ₫,Bộ Đồ Nam Chất Thun Da Cá Áo Hoodies Túi Hộp Phối Màu Đỏ Họa Tiết Rằn Ri Kết Hợp Quần Jogger Phối Dây Chữ Trẻ Trung Thời Trang FORHIMCS2 SET NAM 9000089,76%,114.700 ₫,97%,FORHIMCS2,12.900 ₫,267 Ratings
OEM,99%,1 - 5 ngày,-79%,//vn-live-05.slatic.net/p/a86bfbf3c599487824e76dec0767f9ae.jpg_720x720q80.jpg_.webp,120.000 ₫,[HCM]ÁO KHOÁC HOODIE MA MỊ SWEATER UNISEX NAM NỮ KHÔNG XÙ LÔNG TRẺ TRUNG NĂNG ĐỘNG_TP564,93%,25.000 ₫,99%,Xưởng Sỉ Giá Gốc,12.900 ₫,1 Ratings
No Brand,99%,1 - 5 ngày,-90%,//vn-live-05.slatic.net/p/15a3dbc3fab05c870e5a792fdc47d85b.jpg_720x720q80.jpg_.webp,59.000 ₫,[HCM]ÁO KHOÁC ÁO HOODIE NAM NỮ S.O SWEATER VẪY CHỮ FORM RỘNG CHẤT NỈ DÀY DẶN ẤM ẤP PINK SHOP,92%,6.000 ₫,97%,Pink.Shop,12.900 ₫,5 Ratings
OEM,100%,4 - 6 ngày,-57%,//vn-live-05.slatic.net/p/mdc/16013fc20851a7b60036e2a4fa8f8111.jpg_720x720q80.jpg_.webp,195.000 ₫,Bộ Quần Áo Hoodie Nam Dài Tay Mũ Trùm Đầu Họa Tiết Ô Chữ Nhật Lồng CITY Phối Chữ Dọc Tay Phá Cách Kiểu Dáng Thể Thao Trẻ Trung Năng Động C-CHAT QA NAM CC118,72%,84.000 ₫,100%,C-Chat Page,22.000 ₫,105 Ratings
No Brand,90%,1 - 5 ngày,-45%,//vn-live-05.slatic.net/p/4f585c48447696b594d0c9b4c62e04fa.png_720x720q80.jpg_.webp,99.000 ₫,Áo sweater Unisex in Vải nỉ bông size từ 35-70kg nhiều màu lựa chọn,96%,54.000 ₫,100%,Cachuch,12.900 ₫,272 Ratings
Zenko,100%,4 - 6 ngày,-66%,//vn-live-05.slatic.net/p/ac019b446cc611feca5b84b0fcea025c.jpg_720x720q80.jpg_.webp,138.000 ₫,Áo Hoodie Nỉ Nam Thu Đông Mũ Trùm Họa Tiết SIERMAN Phối Chữ Dọc Tay IT CAN’T RAIN In Hình Người Mặt Sau Phong Cách Đường Phố Thời Trang Hot Trend Sành Điệu HNDC TinaStore TOP NAM 155,75%,47.000 ₫,100%,tinastore3,22.000 ₫,237 Ratings
No Brand,99%,1 - 5 ngày,-53%,//vn-live-05.slatic.net/p/a59f1ff3dfe6ea43d218fe41dab3ff96.jpg_720x720q80.jpg_.webp,78.000 ₫,[HCM]ÁO KHOÁC NAM HOODIE TEBIEPAL CỰC CHẤT CAO CẤP KHÔNG XÙ LÔNG TRẺ TRUNG NĂNG ĐỘNG,90%,37.000 ₫,96%,Blackwhite1,12.900 ₫,89 Ratings
OEM,99%,1 - 5 ngày,-49%,//vn-live-05.slatic.net/p/9722f5910948755e3dfa84aeebb59224.jpg_720x720q80.jpg_.webp,195.000 ₫,Bộ Đồ Nam Chất Thun Da Cá Áo Hoodies Túi Hộp BORFEND Kết Hợp Quần Jogger Phối Dây Chữ Trẻ Trung Thời Trang 4MENHCM SET NAM 9000087,77%,100.190 ₫,99%,fashion4menhcm,12.900 ₫,116 Ratings
No Brand,94%,1 - 5 ngày,-50%,//vn-live-05.slatic.net/p/c930115b58811053c2f6f8f145771546.jpg_720x720q80.jpg_.webp,40.000 ₫,ÁO KHOÁC HOODIE CẶP ĐÔI THỜI TRANG ĐẾN TỪ HÀN QUỐC SIÊU ĐẸP ẤM ÁP MÙA ĐÔNG,73%,20.000 ₫,97%,NEYMAR,12.900 ₫,12 Ratings
